<?xml version="1.0" encoding="utf-8"?>

<BFHRGP xmlns:xsi="http://www.w3.org/2001/XMLSchema-instance" xsi:noNamespaceSchemaLocation="BFHRGP_TV.xsd">

	<termek TermekKod="1">
		<nev>Samsung tv</nev>
		<ar>109990</ar>
		<meret>120</meret>
	</termek>

	<termek TermekKod="2">
		<nev>LG tv</nev>
		<ar>89990</ar>
		<meret>80</meret>
	</termek>

	<vasarlo VasarloID="1">
		<nev>Nagy Béla</nev>
		<iranyitoszam>3300</iranyitoszam>
		<varos>Eger</varos>
		<utca>Merengő</utca>
		<hazszam>1</hazszam>
		<FizMod>kartya</FizMod>
	</vasarlo>
	
	<vasarlo VasarloID="2">
		<nev>Nagy János</nev>
		<iranyitoszam>3535</iranyitoszam>
		<varos>Miskolc</varos>
		<utca>Eper</utca>
		<hazszam>2</hazszam>
		<FizMod>kezpenz</FizMod>
	</vasarlo>

	<vasarlas VasarlasID="1">
		<darab>1</darab>
		<datum>2024.12.01</datum>
		<TermekKod>1</TermekKod>
		<VasarloID>1</VasarloID>
	</vasarlas>

	<vasarlas VasarlasID="2">
		<darab>2</darab>
		<datum>2024.12.11</datum>
		<TermekKod>2</TermekKod>
		<VasarloID>2</VasarloID>
	</vasarlas>

</BFHRGP>